movie_title,genres,content,rating,movie_id,review_id,author,created_at,cleaned_text,category
Star Wars: The Last Jedi,"['Adventure', 'Action', 'Science Fiction']","""Not the best but certainly the most overhyped""

As the Rebellion tries to evade The First Order, Rey asks Luke Skywalker to teach her the ways of the Force. Meanwhile Kylo Ren is still a whiny POS.

Director/writer Rian Johnson faced a gargantuan task. Two years ago J.J. Abrams did the impossible by making a successful sequel to ‘Star Wars’. Johnson had to follow that up with something more creative because let’s be honest, ‘The Force Awakens’ (TFA) was a copy. He succeeds partially.

When the movie started there were cheers. It doesn’t get any better than the iconic opening crawl with John Williams’ score. Although there’s a certain resemblance to ‘The Empire Strikes Back’ (opening scene, Luke on the remote planet) ‘The last Jedi’ isn’t a copy. Johnson has came up with a more or less original story with new characters and some twists.
However, the problem with some of the new characters is that they get too much screen time while contributing nothing to the story. In some cases up to the point where they’re just plain annoying. Benicio Del Toro anyone? Meanwhile we find out nothing new about the characters we got to know in ‘TFA’. Rey, Finn & Dameron still feel new.

The villains are another problem. The most iconic part about ‘Star Wars’ has always been the villains. Darth Vader is an icon. Emperor Palpatine and Darth Maul were also quite impressive. Without spoiling anything I think it’s safe to say Kylo Ren (who’s still suffering from huge mommy and daddy issues), Supreme Leader Snoke & General Hux are terribly underwhelming.

That of course doesn’t mean it’s a bad movie. Although it runs too long it entertains. The effects and choreography are top notch and the overall look of the film is stunning. DOP Steve Yedlin does a fine job. The final battle looks amazing ( the red stripes on the salt plains). Although there’s a bit too much humor for our liking, there’s some genuine funny moments. The Porgs have a bright future ahead of them marketingwise.
Of course there’s the nostalgia factor. It’s great to see those familiar faces again and the sound of lightsabres and TIE fighters are music to our ears.

On the other hand it’s obvious Johnson and Disney want to go down a new path. Whether that path is the right one remains to be seen. With the announcement of a new trilogy coming up it feels like they’re milking it. And you can take that literally. What’s up with that milk scene? Cringeworthy.

The biggest problem is that ‘The Last Jedi’ is incredibly hyped. There are reviews that say the movie is dark and that it’s the best since ‘The Empire Strikes Back’. I know opinions can differ but it doesn’t come close to any of the original trilogy.",7.0,181808,5bf85e340e0a261ac208d94d,moovies,2018-11-23T20:08:20.923Z,best certainly overhyped rebellion tries evade first order rey asks luke skywalker teach ways force meanwhile kylo ren still whiny pos directorwriter rian johnson faced gargantuan task two years ago jj abrams impossible making successful sequel ‘star wars’ johnson follow something creative let’s honest ‘the force awakens’ tfa copy succeeds partially movie started cheers doesn’t get better iconic opening crawl john williams’ score although there’s certain resemblance ‘the empire strikes back’ opening scene luke remote planet ‘the last jedi’ isn’t copy johnson came less original story new characters twists however problem new characters get much screen time contributing nothing story cases point they’re plain annoying benicio del toro anyone meanwhile find nothing new characters got know ‘tfa’ rey finn dameron still feel new villains another problem iconic part ‘star wars’ always villains darth vader icon emperor palpatine darth maul also quite impressive without spoiling anything think it’s safe say kylo ren who’s still suffering huge mommy daddy issues supreme leader snoke general hux terribly underwhelming course doesn’t mean it’s bad movie although runs long entertains effects choreography top notch overall look film stunning dop steve yedlin fine job final battle looks amazing red stripes salt plains although there’s bit much humor liking there’s genuine funny moments porgs bright future ahead marketingwise course there’s nostalgia factor it’s great see familiar faces sound lightsabres tie fighters music ears hand it’s obvious johnson disney want go new path whether path right one remains seen announcement new trilogy coming feels like they’re milking take literally what’s milk scene cringeworthy biggest problem ‘the last jedi’ incredibly hyped reviews say movie dark it’s best since ‘the empire strikes back’ know opinions differ doesn’t come close original trilogy,"Adventure, Action, Science Fiction"
xXx,"['Action', 'Adventure', 'Thriller', 'Crime', 'Drama']","Vin Diesel is actually quite good in this as an adventurer who manages, frequently, to wind up US law enforcement by causing mischief and mayhem against those he thinks deserving of exposure. When NSA agent ""Gibbons"" (Samuel L. Jackson) arranges for him and his team to be dumped in the Czech Republic they have a choice - infiltrate a ruthless gang of Russian hoodlums bent on world domination or... go to jail. Initially, the team think it's all an hoax but as it becomes clear that they actually are in a real scenario it all starts to heat up. Diesel has bags of charisma, attitude and muscle on screen, for this. Sure, it's not new nor will the writing and dialogue cause you to need a dictionary (unless you are about seven years old) but as action films go, it is perfectly watchable with plenty of car chases, pyrotechnics and gadgets",6.0,7451,64f42f159e4586013af8fb34,CinemaSerf,2023-09-03T07:00:37.771Z,vin diesel actually quite good adventurer manages frequently wind us law enforcement causing mischief mayhem thinks deserving exposure nsa agent gibbons samuel l jackson arranges team dumped czech republic choice infiltrate ruthless gang russian hoodlums bent world domination go jail initially team think hoax becomes clear actually real scenario starts heat diesel bags charisma attitude muscle screen sure new writing dialogue cause need dictionary unless seven years old action films go perfectly watchable plenty car chases pyrotechnics gadgets,"Action, Adventure, Thriller, Crime, Drama"
The Housemaid,"['Mystery', 'Thriller']","This movie was genuinely exciting to watch. Millie is a bold and interesting character, and I liked the idea of her targeting creepy, psychologically disturbed men. There is something satisfying about how brave and calculated she is, and the way the film presents her at first makes you think you are watching a completely different kind of story. The movie feels very professional in terms of direction, atmosphere, and pacing. What I enjoyed most is how unpredictable it is. At the beginning, Millie comes off as cute and almost innocent, and it seems like Andrew and Nina are just part of a normal setup. I expected Nina to be the real problem, but the story flips and reveals Andrew as the true villain, which caught me off guard in a good way. Overall, the vibe of the movie is very mysterious and tense, and it keeps you guessing about who is actually dangerous and who is not. If you like thrillers with twists and morally complex characters, this one is worth watching :D",7.0,1368166,6984b68a8b19aab55b9d197d,alaeTR,2026-02-05T15:26:02.516Z,movie genuinely exciting watch millie bold interesting character liked idea targeting creepy psychologically disturbed men something satisfying brave calculated way film presents first makes think watching completely different kind story movie feels professional terms direction atmosphere pacing enjoyed unpredictable beginning millie comes cute almost innocent seems like andrew nina part normal setup expected nina real problem story flips reveals andrew true villain caught guard good way overall vibe movie mysterious tense keeps guessing actually dangerous like thrillers twists morally complex characters one worth watching,"Mystery, Thriller"
Star Wars: The Last Jedi,"['Adventure', 'Action', 'Science Fiction']","How very, very disappointing this was. The not in the least menacing ""Kylo Ren"" (Adam Driver) has got the rag-tag rebel fleet under the command of his mum ""Princess/General Leia"" (Carrie Fisher) firmly in his sights, and only ""Luke"" (Mark Hamill) who is training ""Rey"" (Daisy Ridley) to become a Jedi too, can hope to thwart their ultimate destruction as the First Order's intergalactic pursuit gradually whittles down the remains of their fleet. Meantime, ""Finn"" (John Boyega) with the scene stealing BB-8 embark on an highly dangerous mission to nobble the tracking device that is putting them all in such peril. The original ""Star Wars"" (1977) is probably my favourite film ever, and this is not even a distant cousin. Sure there are a few vestiges of the first film - the attack on the Dreadnought is quite exciting, but the rest of this is a poorly written and conceived version that throws the characterisations under the bus that is CGI. Great effects, loads of laser shoot 'em ups, but where has the charisma gone? There is no jeopardy - the storyline plods along with bumps in the road, but with little doubt as to the final outcome. For me (a baddie-lover) that means the thing lacks anything of interest. I enjoyed it ok - I saw it as part of a triple bill before the final instalment was released, but the more I watched the less I remembered. What a pity.",6.0,181808,665e0266e7907a34c3bc924e,CinemaSerf,2024-06-03T17:50:30.656Z,disappointing least menacing kylo ren adam driver got ragtag rebel fleet command mum princessgeneral leia carrie fisher firmly sights luke mark hamill training rey daisy ridley become jedi hope thwart ultimate destruction first orders intergalactic pursuit gradually whittles remains fleet meantime finn john boyega scene stealing bb8 embark highly dangerous mission nobble tracking device putting peril original star wars 1977 probably favourite film ever even distant cousin sure vestiges first film attack dreadnought quite exciting rest poorly written conceived version throws characterisations bus cgi great effects loads laser shoot em ups charisma gone jeopardy storyline plods along bumps road little doubt final outcome baddielover means thing lacks anything interest enjoyed ok saw part triple bill final instalment released watched less remembered pity,"Adventure, Action, Science Fiction"
"""Wuthering Heights""","['Romance', 'Drama']","I’m not sure, with the exception of “Barbie” (2023), that I’ve ever seen a film with Margot Robbie and really understood what all the fuss was about. Even there, that was more to do with Ryan Gosling knowing how to entertain whilst looking good. This time, she relies on Jacob Elordi for that support and if possible, he is even more wooden than her. Sure, he’d look good in a wet shirt contest, but that rather sums up this terribly disappointing adaptation of Emily Brontë’s novel. “Cathy” is the daughter of the wealthy but temperamental “Earnshaw” (Martin Clunes) and ever since she was young has had a close relationship with his ward “Heathcliff”. Thing is, though, as her father is guzzling his way through what little cash they have left she has to think on her feet. Perhaps the newly arrived velvet millionaire “Edgar” (Shazad Latif) might just offer a solution? Snooping on him one evening, she manages to sprain her ankle and so ensure an invitation to stay and recuperate with him and the ribbon-collecting “Isabella” (Alison Oliver). Narked, before we know it the smouldering one has pinched their only horse and gone off in the huff. It’s some years before he returns, a wealthy man, during which time she has married and is expecting a bairn - but can they continue to keep their hands off each other now they are in similar social classes? So much of the original story is in the gentle but powerful development of both the characters and the pulsating, seamy and evocative story, set against the bleakness of the Yorkshire landscape. This, on the other hand, over-relies on what we can see and what we might already know about the characters and so leaves us with something really quite shallow. It does look as if effort has gone into the look of the production but the screenplay has been stripped back to something barely recognisable and when there are opportunities for it to grab us by the throat, we default to some Enya-esque songs from a Charlie XCX who might actually be the most creatively influencing here. I’m sorry, but this was a real missed opportunity to update one of the most enduring and toxic love stories in the English language, but instead we have something that is so much style over substance. More withering than wuthering, and no heights at all here for me - no wonder they have been promoting it so heavily.",6.0,1316092,699608d9e950ebb1c64a91b3,CinemaSerf,2026-02-18T18:45:45.071Z,i’m sure exception “barbie” 2023 i’ve ever seen film margot robbie really understood fuss even ryan gosling knowing entertain whilst looking good time relies jacob elordi support possible even wooden sure he’d look good wet shirt contest rather sums terribly disappointing adaptation emily brontë’s novel “cathy” daughter wealthy temperamental “earnshaw” martin clunes ever since young close relationship ward “heathcliff” thing though father guzzling way little cash left think feet perhaps newly arrived velvet millionaire “edgar” shazad latif might offer solution snooping one evening manages sprain ankle ensure invitation stay recuperate ribboncollecting “isabella” alison oliver narked know smouldering one pinched horse gone huff it’s years returns wealthy man time married expecting bairn continue keep hands similar social classes much original story gentle powerful development characters pulsating seamy evocative story set bleakness yorkshire landscape hand overrelies see might already know characters leaves us something really quite shallow look effort gone look production screenplay stripped back something barely recognisable opportunities grab us throat default enyaesque songs charlie xcx might actually creatively influencing i’m sorry real missed opportunity update one enduring toxic love stories english language instead something much style substance withering wuthering heights wonder promoting heavily,"Romance, Drama"
Jurassic World Rebirth,"['Science Fiction', 'Adventure', 'Action']","Well at least there is one scene where huge great dinosaurs walk, accompanied by John Williams’s original theme, to remember - but otherwise this is a really disappointing video-game of a film that offers us nothing at all that the Jurassic franchise hasn’t already. By now, these great creatures have largely been taken care of by Mother Nature and have been reduced to living in small groups in equatorial zones around the world where they just want to be left alone to eat and be eaten, protected from a humanity which is “expressly” prohibited from going there. The grasping “Krebs” (Rupert Friend - Orlando Bloom must have been busy) has a plan to cure heart disease and so recruits special ops veteran “Zora” (Scarlett Johansson) to help him secure the living DNA from three of the greatest of these creatures. They wouldn’t know one if they saw one though, so have to convince the nerdy scientist “Loomis” (Jonathan Bailey) to accompany them and their local fixer “Kincaid” (Mahershala Ali) and they head deep into these deadly waters. Meantime, a family are blithely sailing from Bermuda to Cape Town, apparently unaware of the dangers posed by these Vernian monsters. They are dad, young daughter, hormonal older daughter and her bone idle boyfriend, “Xavier” (David Iacono). Boy are they in for a shock when they cross some huge great, and angry, Mosasaurus and end up with most of their boat pointing the wrong way in the water, but with “Xavier” still able to catch some rays whilst they await rescue from, well you can guess who comes, and largely what happens from here on in. For much of the movie, we have two parallel storylines to underwhelm us: the unarmed yet remarkably resilient family have to find an abandoned HQ whilst the mercenaries play a sort of level-by-level game navigating the usual island full of beasties adventures that haven’t really advanced much since it’s nearest biological cousin - “Jurassic Park III” (2001). Oddly enough, I didn’t think these visual effects were anywhere near as effective as in the originals. Maybe we are all just too used to these great animals lumbering about on land, breaching like whales at sea, or swooping and pecking relentlessly from the air? Johansson does join in enthusiastically and Jonathan Bailey really has one one of those smiles on his face that suggests he is enjoying his days in front of the green screen knowing it has to be easier than singing “Not Getting Married” on stage eight times a week - and probably better paid. The others really only make up the numbers, though, with a few characters obviously designated as dino-fodder early-on as it rehashes scenarios from just about everything from “Indian Jones” to “Harry Potter”. It might be like comparing apples and pears, but I have to say I found the current “How to Train Your Dragon” a much more enjoyable adventure about man’s relationship with thick-skinned, scaly, predators, because this entirely forgettable film will do little more than slot nicely into the Christmas television schedules with little, if anything, to distinguish about it once it’s grand scale cinema run has concluded. PS: I don’t know about inventing a miracle-cure drug, but whoever designed JB’s glasses ought to patent a design that stays firmly affixed to his face the entire time without moving, cracking, breaking or even slipping down his nose!",6.0,1234821,686e652169fa3110009a4dd4,CinemaSerf,2025-07-09T12:48:33.613Z,well least one scene huge great dinosaurs walk accompanied john williams’s original theme remember otherwise really disappointing videogame film offers us nothing jurassic franchise hasn’t already great creatures largely taken care mother nature reduced living small groups equatorial zones around world want left alone eat eaten protected humanity “expressly” prohibited going grasping “krebs” rupert friend orlando bloom must busy plan cure heart disease recruits special ops veteran “zora” scarlett johansson help secure living dna three greatest creatures wouldn’t know one saw one though convince nerdy scientist “loomis” jonathan bailey accompany local fixer “kincaid” mahershala ali head deep deadly waters meantime family blithely sailing bermuda cape town apparently unaware dangers posed vernian monsters dad young daughter hormonal older daughter bone idle boyfriend “xavier” david iacono boy shock cross huge great angry mosasaurus end boat pointing wrong way water “xavier” still able catch rays whilst await rescue well guess comes largely happens much movie two parallel storylines underwhelm us unarmed yet remarkably resilient family find abandoned hq whilst mercenaries play sort levelbylevel game navigating usual island full beasties adventures haven’t really advanced much since it’s nearest biological cousin “jurassic park iii” 2001 oddly enough didn’t think visual effects anywhere near effective originals maybe used great animals lumbering land breaching like whales sea swooping pecking relentlessly air johansson join enthusiastically jonathan bailey really one one smiles face suggests enjoying days front green screen knowing easier singing “not getting married” stage eight times week probably better paid others really make numbers though characters obviously designated dinofodder earlyon rehashes scenarios everything “indian jones” “harry potter” might like comparing apples pears say found current “how train dragon” much enjoyable adventure man’s relationship thickskinned scaly predators entirely forgettable film little slot nicely christmas television schedules little anything distinguish it’s grand scale cinema run concluded ps don’t know inventing miraclecure drug whoever designed jb’s glasses ought patent design stays firmly affixed face entire time without moving cracking breaking even slipping nose,"Science Fiction, Adventure, Action"
Send Help,"['Horror', 'Thriller', 'Comedy']","The spirit of “Nine to Five” (1980) is alive and well for “Linda” (Rachel McAdams) as she is constantly being passed over for promotion by golf-playing men who rely on her to do all the work. She hopes for change when new employer “Bradley” (Dylan O’Brien) takes over from his dad, but a combination of his best mate from university and her liking for tuna duly kiboshes that. She is, however, to embark on a team trip to Thailand for a merger meeting and it’s en route that a violent storm leaves her and her hapless boss stranded on a tropical island. It turns out that she is a woman well equipped to survive whilst the injured ""Brad"" hasn’t a clue, so yet again she appears to be doing all the donkey work whilst he lies under a palm frond expecting to be waited on hand and foot. Exasperated, “Linda” decides she can get by without this obnoxious parasite and so leaves him to languish in the sun in the hope that he will come to realise his failings and her value. Now with new lines slowly being drawn between them, what chance they will be rescued and are either of them being remotely honest with the other? Whilst this isn’t really scary at all, there is still quite a fun “Robinson Crusoe” dynamic between McAdams and O’Brien as their battle of the sexes ebbs and flows. They finesse the arts of boar hunting and berry eating; he learns to appreciate the eye-watering dangers of toxic fish and for most of the film it’s an enjoyably pithy and well-written joust between these two, clearly unevenly matched, characters. I didn’t really like the last twenty minutes so much. They felt rushed, unnecessarily violent and though there is a juicy degree of vindication about it, it didn’t quite top off what is an otherwise entertaining drama that mercifully keeps romance at bay throughout as it shouts clearly the benefits of a meritocracy.",7.0,1198994,698cced895efac1ec2425e0e,CinemaSerf,2026-02-11T18:47:52.236Z,spirit “nine five” 1980 alive well “linda” rachel mcadams constantly passed promotion golfplaying men rely work hopes change new employer “bradley” dylan o’brien takes dad combination best mate university liking tuna duly kiboshes however embark team trip thailand merger meeting it’s en route violent storm leaves hapless boss stranded tropical island turns woman well equipped survive whilst injured brad hasn’t clue yet appears donkey work whilst lies palm frond expecting waited hand foot exasperated “linda” decides get without obnoxious parasite leaves languish sun hope come realise failings value new lines slowly drawn chance rescued either remotely honest whilst isn’t really scary still quite fun “robinson crusoe” dynamic mcadams o’brien battle sexes ebbs flows finesse arts boar hunting berry eating learns appreciate eyewatering dangers toxic fish film it’s enjoyably pithy wellwritten joust two clearly unevenly matched characters didn’t really like last twenty minutes much felt rushed unnecessarily violent though juicy degree vindication didn’t quite top otherwise entertaining drama mercifully keeps romance bay throughout shouts clearly benefits meritocracy,"Horror, Thriller, Comedy"
