movie_title,genres,content,rating,movie_id,review_id,author,created_at,cleaned_text,category
Hoppers,"['Animation', 'Family', 'Science Fiction', 'Comedy', 'Adventure']","entertainment movie, not so engaging but one time watch is good.
some scenes are really enjoyable, concept is good by the way.",8.0,1327819,69b7c0fb569e003b4b5ca113,emailaddressforgl,2026-03-16T08:36:11.793Z,entertainment movie engaging one time watch good scenes really enjoyable concept good way,"Animation, Family, Science Fiction, Comedy, Adventure"
The Shawshank Redemption,"['Drama', 'Crime']",very good movie 9.5/10 محمد الشعراوى,9.0,278,5723a329c3a3682e720005db,elshaarawy,2016-04-29T18:08:41.892Z,good movie 9510 محمد الشعراوى,"Drama, Crime"
The Avengers,"['Science Fiction', 'Action', 'Adventure']","I give this 10 Stars based on it being not only better than the trailer and the hype made me thing it would be, but also that it was the first time anything the size and scope of the Marvel Cinematic universe was pulled off successfully. Having Joss direct this movie lives and dies on character interaction. This movie is on the definitive list in my opinion even just for that.",8.5,24428,5cad1876c3a36812a018fc9c,E.J. Cummings,2019-04-09T22:11:02.850Z,give 10 stars based better trailer hype made thing would also first time anything size scope marvel cinematic universe pulled successfully joss direct movie lives dies character interaction movie definitive list opinion even,"Science Fiction, Action, Adventure"
The Super Mario Bros. Movie,"['Family', 'Comedy', 'Adventure', 'Fantasy', 'Animation']",SOOOOO FIRE I LOVEEEE MARIO PLEEASE MAKE ANOTHER I LOVE YOU MARIO <3,10.0,502356,646bbf8ed1857201802df9c0,holdenc,2023-05-22T19:16:30.951Z,sooooo fire loveeee mario pleease make another love mario 3,"Family, Comedy, Adventure, Fantasy, Animation"
Avengers: Endgame,"['Adventure', 'Science Fiction', 'Action']","If you enjoy reading my Spoiler-Free reviews, please follow my blog :)

Don't worry. This is going to be a pretty vague review. Right now, as I'm writing this sentence, I'm still processing what I saw and how am I going to explain how I felt without spoiling a single tiny thing. First of all, it's such a mix of feelings. On one hand, I'm extremely happy that I was lucky to be alive during this epic time and that I was able to follow these characters that I love and care about so much. On the other hand, I'm obviously sad that it finally reached the end of this (hopefully) first incredible saga. There are no perfect films and one with so many heroes will always have struggles balancing it all (Infinity War already had this issue). 

However, the Russo brothers did everything they could to deliver a phenomenal story, and they did. I don't think this could have been any better. Its last hour exceeds any expectations. It's epic, emotional, action-heavy, and it has one of my favorite shots in the entire history of cinema. It's pure magic, and the VFX team will surely get an Oscar for it. The action reminded me of the biggest Lord of the Rings' battles, and it was impeccably filmed, filled with riveting and chill-inducing sequences. Nevertheless, don't expect this high-intensity feeling throughout the whole runtime. The other two acts are a slow-burn build-up to a payoff that's going to make you pretty much either ""love"" or ""like"" this movie. I absolutely love it! 

This is easily one of the best MCU films, if not my new number one. I can't deny that the 3-hour runtime has some unnecessary scenes, but even if they don't have a significant impact on the plot or even in the characters, they still contribute to the enormous build-up. Seeing this family that we grew up with just talking with each other or having lunch, at the same time that they deal with the consequences of Thanos' snap, is inexplicably captivating and heartwarming. Characters like Natasha (Scarlett Johansson) and Steve (Chris Evans) supporting each other is simply beautiful. Their comradery and chemistry are worthy of some tears here and there.

Some people didn't really enjoy Infinity War so much due to the lack of screentime that some characters had. This time around, there are fewer characters to work with, so the balance is better. Everyone gets an important role, from Captain America to Ant-Man (Paul Rudd) to Nebula (Karen Gillan), and even Rocket (Bradley Cooper). Every single character has a major moment. If you take one out of the movie, it just doesn't work anymore. This is not only great work from the directors, but also from the writers. 

Christopher Markus and Stephen McFeely are not even going to be remembered because fans will always think of the cast first. Most of them will also remember the directors. But the writers?! If I stand at the door of the theater at the end of the film and question everyone about who are the writers, I strongly believe most of the audience won't know. Every dialogue, every sentence, every word carries so much impact on the narrative. Literally, I cried and got chills just by hearing two freaking words with the perfect timing in between. The amount of grief that the words of the ones who've lost everyone and everything carry is palpable and, for me, those are the most emotional moments of the movie: seeing how everyone is suffering from their own losses, not the deaths themselves.

The humor is mostly on-point, but it's still connected to my only real issue with the film, which is the second act's tone. From the moment the team decides what to do, we already know that this is a 1 in 14 million chance of success like Dr. Strange (Benedict Cumberbatch) said, so the stakes and pressure are massive! With this level of tension, I didn't expect such an “easygoing” and “funny” vibe throughout, except for one particular sequence. They do a great job once again of pairing up certain Avengers together, but most of them go through these too comedic plot points for such a crucial and serious mission. Fortunately, this act carries enough action and emotional drive to make this problem not that big of an issue.

Visually, this is arguably the best-looking superhero film ever. From the mind-blowing visual effects to the gorgeous cinematography, everything is perfect. The costumes are gritty and muddy when our heroes are in a battle, their faces are all filled with blood, and I have no words to describe how jaw-dropping that last act is. I can't wait to change my desktop wallpaper once THAT shot is available. I dropped a single tear just by looking at it. No one talks, no one does anything. It's just an amazingly beautiful image. The score is epic as hell. So much that I'm listening to it right now as I'm writing this review, and I'm getting chills all over my body. 

I can't really write much more, to be honest. I will acknowledge the cast because they are brilliant. Each and every single member delivers an outstanding performance, but if I had to choose the ones that both surprised me and had the most impact on me, they would be Johansson's, Evans', and Robert Downey Jr's (Tony Stark / Iron Man). “New” characters like Captain Marvel (Brie Larson) blend seamlessly, and the payoff is unbelievably satisfying. In terms of predictability, it goes more or less as I expected, but it still carries a few surprises throughout. Nothing is ever like we imagine or theorize about, so expect the unexpected, and don't judge a movie by if it fits your crazy, unrealistic theories that never crossed the producers and directors' minds in the first place!

All in all, I don't know what to do now. The only thing I'm sure of is that I want to see it again, as soon as possible. The last hour is f*cking insane. I couldn't fall asleep properly because I couldn't stop thinking about it. Endgame surpasses all expectations. It's everything I wished for and so much more. I could easily spend a whole day at the movie theater and watch three sessions in a row. It's that good. One of the best comic-book films of all-time, without a single doubt. Thank you to Kevin Feige and everyone who worked hard to bring the MCU to where it stands now. I can't even think of how are they going to produce something at the level of Infinity Saga. Maybe they never will. Maybe we'll have to wait another decade or two for something like this. Until then, see you at the next Endgame screening! Enjoy! Oh and #DontSpoilTheEndgame!

PS: it's not a perfect movie, I know. It doesn't exist one. Yes, Endgame has some issues regarding its pacing and tone, but I would be lying to myself if this isn't everything I dreamed of. I felt the same way with Civil War, regarding the rating to give, and I ended up giving it an A after a first viewing. As soon as I watched the second time, I changed it to an A+. I don’t need to wait for that second viewing with Endgame … And thank you to my audience for being incredibly respectful. No yelling, no crazy laughs, no stupid people doing stupid stuff. Thank you so much for not ruining one of the best cinematic experiences of my life!

Rating: A+",10.0,299534,5cc307bfc3a36809ab86e2fd,Manuel São Bento,2019-04-26T13:29:35.406Z,enjoy reading spoilerfree reviews please follow blog dont worry going pretty vague review right im writing sentence im still processing saw going explain felt without spoiling single tiny thing first mix feelings one hand im extremely happy lucky alive epic time able follow characters love care much hand im obviously sad finally reached end hopefully first incredible saga perfect films one many heroes always struggles balancing infinity war already issue however russo brothers everything could deliver phenomenal story dont think could better last hour exceeds expectations epic emotional actionheavy one favorite shots entire history cinema pure magic vfx team surely get oscar action reminded biggest lord rings battles impeccably filmed filled riveting chillinducing sequences nevertheless dont expect highintensity feeling throughout whole runtime two acts slowburn buildup payoff thats going make pretty much either love like movie absolutely love easily one best mcu films new number one cant deny 3hour runtime unnecessary scenes even dont significant impact plot even characters still contribute enormous buildup seeing family grew talking lunch time deal consequences thanos snap inexplicably captivating heartwarming characters like natasha scarlett johansson steve chris evans supporting simply beautiful comradery chemistry worthy tears people didnt really enjoy infinity war much due lack screentime characters time around fewer characters work balance better everyone gets important role captain america antman paul rudd nebula karen gillan even rocket bradley cooper every single character major moment take one movie doesnt work anymore great work directors also writers christopher markus stephen mcfeely even going remembered fans always think cast first also remember directors writers stand door theater end film question everyone writers strongly believe audience wont know every dialogue every sentence every word carries much impact narrative literally cried got chills hearing two freaking words perfect timing amount grief words ones whove lost everyone everything carry palpable emotional moments movie seeing everyone suffering losses deaths humor mostly onpoint still connected real issue film second acts tone moment team decides already know 1 14 million chance success like dr strange benedict cumberbatch said stakes pressure massive level tension didnt expect “easygoing” “funny” vibe throughout except one particular sequence great job pairing certain avengers together go comedic plot points crucial serious mission fortunately act carries enough action emotional drive make problem big issue visually arguably bestlooking superhero film ever mindblowing visual effects gorgeous cinematography everything perfect costumes gritty muddy heroes battle faces filled blood words describe jawdropping last act cant wait change desktop wallpaper shot available dropped single tear looking one talks one anything amazingly beautiful image score epic hell much im listening right im writing review im getting chills body cant really write much honest acknowledge cast brilliant every single member delivers outstanding performance choose ones surprised impact would johanssons evans robert downey jrs tony stark iron man “new” characters like captain marvel brie larson blend seamlessly payoff unbelievably satisfying terms predictability goes less expected still carries surprises throughout nothing ever like imagine theorize expect unexpected dont judge movie fits crazy unrealistic theories never crossed producers directors minds first place dont know thing im sure want see soon possible last hour fcking insane couldnt fall asleep properly couldnt stop thinking endgame surpasses expectations everything wished much could easily spend whole day movie theater watch three sessions row good one best comicbook films alltime without single doubt thank kevin feige everyone worked hard bring mcu stands cant even think going produce something level infinity saga maybe never maybe well wait another decade two something like see next endgame screening enjoy oh dontspoiltheendgame ps perfect movie know doesnt exist one yes endgame issues regarding pacing tone would lying isnt everything dreamed felt way civil war regarding rating give ended giving first viewing soon watched second time changed don’t need wait second viewing endgame … thank audience incredibly respectful yelling crazy laughs stupid people stupid stuff thank much ruining one best cinematic experiences life rating,"Adventure, Science Fiction, Action"
After We Fell,"['Drama', 'Romance']","While not my favorite, this one is still up there. In this one, Hardin befriend Tessa's homeless father (as well as a junkie!). They bond together and drink, which turned out to be my favorite part of the movie. Some really great acting, especially when Hardin hands him money to go buy drugs, killing him in the process. He also takes the time to cheat on his girlfriend multiple times, while she is busy trying to mourn their relationship. He then keeps blaming her, in a masterclass of gaslighting.
Fun for the whole family once again.",9.0,744275,69b4caced1cf92ccee3b89bb,HitlerMalphite,2026-03-14T02:41:18.664Z,favorite one still one hardin befriend tessas homeless father well junkie bond together drink turned favorite part movie really great acting especially hardin hands money go buy drugs killing process also takes time cheat girlfriend multiple times busy trying mourn relationship keeps blaming masterclass gaslighting fun whole family,"Drama, Romance"
"""Wuthering Heights""","['Romance', 'Drama']","Over the top, ridiculously dramatic, and a total blast. 

I loved this movie and have seen it twice now.",10.0,1316092,6993ee852a1af8c6de959bb7,-LBJ-,2026-02-17T04:28:53.171Z,top ridiculously dramatic total blast loved movie seen twice,"Romance, Drama"
Avengers: Infinity War,"['Adventure', 'Action', 'Science Fiction']","Just a very short, NO SPOILERS review I wanted to get down while it's still fresh.

For a movie with this much riding it, to come out not feeling disappointed, is a **massive** achievement. While I absolutely do love it I had some things that I felt were maybe imperfect about _Infinity War_, but my biggest concern was that it seemed like it would be absolutely meaningless to somebody who didn't put in the effort of watching the 18 movies leading up to it. You can probably assuage that fear though, because I went to see it with two people who had only seen _Black Panther_ at this point, and they both loved it, with minimal confusion.

Personally? I can't wait to see it again. This is probably the most excited I've been about the second watch of an MCU film since the first _Avengers_.

_Final rating:★★★★ - Very strong appeal. A personal favourite._",8.0,299536,5ae0a3d20e0a26156301455e,Gimly,2018-04-25T15:50:42.281Z,short spoilers review wanted get still fresh movie much riding come feeling disappointed massive achievement absolutely love things felt maybe imperfect infinity war biggest concern seemed like would absolutely meaningless somebody didnt put effort watching 18 movies leading probably assuage fear though went see two people seen black panther point loved minimal confusion personally cant wait see probably excited ive second watch mcu film since first avengers final rating★★★★ strong appeal personal favourite,"Adventure, Action, Science Fiction"
The Shawshank Redemption,"['Drama', 'Crime']","Morgan Freeman plays a little red haired Irishman and no one cares.  No one cares, and now when people across the globe read this segment in Different Seasons, they read it in Morgan Freeman's voice.  It's sort of impossible not to.  

It was a race swap that not a single person complained about. It didn't really change the movie and one of the big reasons why it didn't change the movie was because the movie wasn't about the race swap and owning the fans of the IP like most every other race swap that people complain about and other people call them political buzz words for not loving... presumably while they secretly agree the movie's crap.

THIS IS HOW YOU DO IT HOLLYWOOD!!

I kind of want to be a dick and say that the reason this movie is so popular is because of Morgan Freeman's narration, I mean, you could give the guy an instruction manual to read and people would love it.

But then it's more than that.  The movie is popular because it's satisfying.  The good guys win, the bad guys lose, it tells a good story in a competent and compelling way.  It's pretty much what everyone wants in a movie... and as much as I usually hate King, the novella is satisfying and what everyone wants from a story.

So well done. You'll like this, and you'll like it because it is that good.",10.0,278,68340a5adc74bba1a60373f6,GenerationofSwine,2025-05-26T06:29:46.896Z,morgan freeman plays little red haired irishman one cares one cares people across globe read segment different seasons read morgan freemans voice sort impossible race swap single person complained didnt really change movie one big reasons didnt change movie movie wasnt race swap owning fans ip like every race swap people complain people call political buzz words loving presumably secretly agree movies crap hollywood kind want dick say reason movie popular morgan freemans narration mean could give guy instruction manual read people would love movie popular satisfying good guys win bad guys lose tells good story competent compelling way pretty much everyone wants movie much usually hate king novella satisfying everyone wants story well done youll like youll like good,"Drama, Crime"
The Godfather,"['Drama', 'Crime']",Great Movie **Ever**,9.0,238,6485943be375c000c5282981,Surya,2023-06-11T09:30:35.855Z,great movie ever,"Drama, Crime"
Avengers: Endgame,"['Adventure', 'Science Fiction', 'Action']",okay so if your like me you questioned this movie due to the fact that i personally thought nothing could beat infinity war well after seeing it i can honestly say we have a new champion this was absolutley excelent so hilarious action packed the 3 hrs passes extremily fast my only thing is the use of god.... bothered me and i suggest if your offended by that wait till dvd so you can mute the parts also a reminder to parents 'no matter how bad you want to see the movie dont do like people in my theater did and bring your 3 year old 'but besides that awesome movie,10.0,299534,5cc5b3b1c3a36849368181c9,heroman,2019-04-28T14:07:45.890Z,okay like questioned movie due fact personally thought nothing could beat infinity war well seeing honestly say new champion absolutley excelent hilarious action packed 3 hrs passes extremily fast thing use god bothered suggest offended wait till dvd mute parts also reminder parents matter bad want see movie dont like people theater bring 3 year old besides awesome movie,"Adventure, Science Fiction, Action"
Sinners,"['Horror', 'Action', 'Thriller']","It’s always gratifying to see a filmmaker take a big step up in his or her career, and that’s precisely what writer-director Ryan Coogler has done in his latest offering, a project that reflects a significant jump in the depth, artistry and sophistication of his creative output. Coming on the heels of his successes in “Black Panther: Wakanda Forever” (2022), “Creed” (2015) and “Fruitvale Station” (2013), Coogler has hit a home run with this period piece smart horror story about identical twin brothers (both played by Michael B. Jordan) who return to their Mississippi home in 1932 after years of working for Al Capone in Chicago, where they made huge money that they now plan to use to open their own juke joint in a converted sawmill. It’s an opportunity where they hope to make even bigger bucks while helping to promote their talented cousin, Sammie (Miles Caton), a blues musician who’s a killer guitarist and vocalist. But, as this ambitious trio launches this effort, they’re confronted with a variety of challenges, including ghosts from their past, the perils of deeply ingrained social prejudice, the dual-edged sword posed by creative and financial success, and, most menacingly, mystical forces that may be more than they’re capable of handling. These narrative components combine to tell a captivating tale about a troubled time in the country’s history, one made all the more ominous with the appearance of supernatural powers that simultaneously offer both potential promise and the prospects of tremendous evil taking root. In bringing this picture to life, the filmmaker has served up an entertaining and engaging offering, one replete with fine performances, superb production values, sharp-edged, perfectly timed comic relief, truly inventive, deftly orchestrated cinematography, and suitably restrained (graphic though not gratuitous) imagery. Admittedly, the screenplay could use some work in a few spots (most notably with tighter writing and clearer plot elaboration), but it also manages to successfully fuse the inherent nature of several genres, including drama, dark humor and smart horror, while also presenting a wealth of insights in an array of areas. Through this picture, it’s easy to see how Coogler has appreciably upped his game as a filmmaker, one that bodes well for his future in the field. It indeed represents the revelation of a talent more profound than anyone has previously recognized or properly acknowledged. “Sinners” is a work that deserves to be remembered come awards season later this year. Let’s hope that it is.",8.0,1233413,680459cde3fac2f90289c279,Brent Marchant,2025-04-20T02:19:57.929Z,it’s always gratifying see filmmaker take big step career that’s precisely writerdirector ryan coogler done latest offering project reflects significant jump depth artistry sophistication creative output coming heels successes “black panther wakanda forever” 2022 “creed” 2015 “fruitvale station” 2013 coogler hit home run period piece smart horror story identical twin brothers played michael b jordan return mississippi home 1932 years working al capone chicago made huge money plan use open juke joint converted sawmill it’s opportunity hope make even bigger bucks helping promote talented cousin sammie miles caton blues musician who’s killer guitarist vocalist ambitious trio launches effort they’re confronted variety challenges including ghosts past perils deeply ingrained social prejudice dualedged sword posed creative financial success menacingly mystical forces may they’re capable handling narrative components combine tell captivating tale troubled time country’s history one made ominous appearance supernatural powers simultaneously offer potential promise prospects tremendous evil taking root bringing picture life filmmaker served entertaining engaging offering one replete fine performances superb production values sharpedged perfectly timed comic relief truly inventive deftly orchestrated cinematography suitably restrained graphic though gratuitous imagery admittedly screenplay could use work spots notably tighter writing clearer plot elaboration also manages successfully fuse inherent nature several genres including drama dark humor smart horror also presenting wealth insights array areas picture it’s easy see coogler appreciably upped game filmmaker one bodes well future field indeed represents revelation talent profound anyone previously recognized properly acknowledged “sinners” work deserves remembered come awards season later year let’s hope,"Horror, Action, Thriller"
