movie_title,genres,content,rating,movie_id,review_id,author,created_at,cleaned_text,category
Sinners,"['Horror', 'Action', 'Thriller']","Michael B. Jordan is “Smoke” and twin brother “Stack” in this classy drama of a pair who’ve lived on the wrong side of the tracks for most of their lives, but have determined to go home and try to go straight. To that end, they buy an old barn and hope to set up their own speakeasy - with only a nominal nod to prohibition - pumping to the rafters with dancing and blues music. On the way, they ally with talented musician “Sammie” (Miles Caton) and, of course, there’s a bit of baggage for the siblings as they return to a town that’s not altogether welcoming. Once home, a mixture of confidence, threats and collective charisma succeeds in assembling a crowd for their opening night. Pretty swiftly, though, that grand celebration attracts the attention of some travellers who are keen to join the party, but perhaps in true Charlie Daniels style, they have an altogether more menacing agenda. This is the cinematic equivalent of an LP, this film. It starts with one side gradually introducing us a rich collection of characters all of whom could quite plausibly have lived in Mississippi at a time when segregation was as rife as illicit booze, and the two more recently hailing from Chicago gives things a certain gangster element too. There is also a very subtly powerful effort from Hailee Steinfield as “Mary” too. The flip side of the record proceeds to develop some elements of peril with the story, and that’s where it rather runs out of steam for me. It tries very hard to create a sense of hot, sweaty and frenzied jeopardy, but maybe because it has already taken quite a long time to get to this stage, that all comes across as a bit rushed and lacking in punch. It looks great, the visual effects are convincing enough and the production design smoulders perfectly. In the end, though, whilst it proves that MBJ is comfortably able to hold a story, Ryan Coogler has overly relied on a marvellously toe-tapping musical score that has been left to do much of the heavy lifting. That latter point is made more essential by a mediocre audio mix that can make the dialogue quite difficult to make out more often than I’d have liked. This seems to be an increasing issue as directors become more ambitious with their visual aspirations leaving the one thing that cannot be readily faked/augmented - the sound - left at the altar. It’s a cinema film, and will look distinctly average on a television so big screen and soundtrack audio is essential to get the best from this silky looking story with an interesting twist at the end, and again at the very end.",7.0,1233413,681f15b1a74b6fc9ebc84997,CinemaSerf,2025-05-10T09:00:33.979Z,michael b jordan “smoke” twin brother “stack” classy drama pair who’ve lived wrong side tracks lives determined go home try go straight end buy old barn hope set speakeasy nominal nod prohibition pumping rafters dancing blues music way ally talented musician “sammie” miles caton course there’s bit baggage siblings return town that’s altogether welcoming home mixture confidence threats collective charisma succeeds assembling crowd opening night pretty swiftly though grand celebration attracts attention travellers keen join party perhaps true charlie daniels style altogether menacing agenda cinematic equivalent lp film starts one side gradually introducing us rich collection characters could quite plausibly lived mississippi time segregation rife illicit booze two recently hailing chicago gives things certain gangster element also subtly powerful effort hailee steinfield “mary” flip side record proceeds develop elements peril story that’s rather runs steam tries hard create sense hot sweaty frenzied jeopardy maybe already taken quite long time get stage comes across bit rushed lacking punch looks great visual effects convincing enough production design smoulders perfectly end though whilst proves mbj comfortably able hold story ryan coogler overly relied marvellously toetapping musical score left much heavy lifting latter point made essential mediocre audio mix make dialogue quite difficult make often i’d liked seems increasing issue directors become ambitious visual aspirations leaving one thing cannot readily fakedaugmented sound left altar it’s cinema film look distinctly average television big screen soundtrack audio essential get best silky looking story interesting twist end end,"Horror, Action, Thriller"
The Devil Wears Prada,"['Drama', 'Comedy']","The cast elevate this film up a lot.

Everything else to do with <em>'The Devil Wears Prada'</em> is all perfectly fine don't get me wrong, but I most certainly wouldn't have enjoyed it as much without the cast. Meryl Streep does an excellent job portraying Miranda, while Anne Hathaway matches her as Andrea. Emily Blunt (Emily) is also enjoyable, as is Stanley Tucci (Nigel).

I never, personally, held too much interest in the plot, it does get a little bit repetitive in parts. With that said, thanks to Streep & Co., it's still a film that's definitely worth watching.",7.0,350,60930d52e8d0b40029452d4e,r96sk,2021-05-05T21:25:38.450Z,cast elevate film lot everything else emthe devil wears pradaem perfectly fine dont get wrong certainly wouldnt enjoyed much without cast meryl streep excellent job portraying miranda anne hathaway matches andrea emily blunt emily also enjoyable stanley tucci nigel never personally held much interest plot get little bit repetitive parts said thanks streep co still film thats definitely worth watching,"Drama, Comedy"
How to Make a Killing,"['Comedy', 'Thriller']","It was always going to be very difficult for this to hold a candle to “Kind Hearts and Coronets” (1949) but I wasn’t really prepared for something quite this insubstantial. It’s really only a vehicle for the ever-amiable Glen Powell but even his character is disappointingly undercooked and it’s another of these films where it’s best bits featured in the trailers. It’s told by way of a confession between “Becket” and a priest as he awaits imminent hanging. His revelations reveal that his mother was from very wealthy stock, but was abandoned after she insisted in having a child with an wholly unsuitable musician. Left to their own devices, they struggled along until she prematurely died and left him looking for retribution. To pay his bills, he has a job in a tailor’s shop where he encounters his rather snobbish childhood friend “Julia” (Margaret Qualley) who plants a devious seed in his mind. What better way to inherit than to ensure that the seven folks further up the family tree all come tumbling down? With things all going swimmingly, he meets the girlfriend of one of his doomed relatives, “Ruth” (Jessica Henwick) and is soon all loved-up. Thing is, the unhappily wed “Julia” cottons on to his cunning plan and so now “Becket” has lots of plates to spin as he tries to keep the girl, get the Rolls Royce and avoid the drop. There are a few moments that raise a smile, but for the most part the drama doesn’t really catch fire. Part of the problem is that it simply doesn’t develop the roles of the “victims” at all. Each get a few moments in the sun, but their parts needed beefing up much more to enhance the comedic and quirky effects of this dark comedy thriller. Ed Harris bowls along towards the end, but that made little sense and I half expected Tim Curry to emerge from behind one of the wooden panels that line the hallway. Qualley looks the part but her persona has none of the mischievous charm nor scheming intricacy it needed to resonate and I left with a worrying sensation that someone, somewhere, fancies the idea of a sequel should this take the money at the box office. It’s watchable enough, but is another cinematic example of something originally unbroken an in no need of fixing seventy-five years later.",6.0,467905,69bade5d00218d68fe3bd364,CinemaSerf,2026-03-18T17:18:21.807Z,always going difficult hold candle “kind hearts coronets” 1949 wasn’t really prepared something quite insubstantial it’s really vehicle everamiable glen powell even character disappointingly undercooked it’s another films it’s best bits featured trailers it’s told way confession “becket” priest awaits imminent hanging revelations reveal mother wealthy stock abandoned insisted child wholly unsuitable musician left devices struggled along prematurely died left looking retribution pay bills job tailor’s shop encounters rather snobbish childhood friend “julia” margaret qualley plants devious seed mind better way inherit ensure seven folks family tree come tumbling things going swimmingly meets girlfriend one doomed relatives “ruth” jessica henwick soon lovedup thing unhappily wed “julia” cottons cunning plan “becket” lots plates spin tries keep girl get rolls royce avoid drop moments raise smile part drama doesn’t really catch fire part problem simply doesn’t develop roles “victims” get moments sun parts needed beefing much enhance comedic quirky effects dark comedy thriller ed harris bowls along towards end made little sense half expected tim curry emerge behind one wooden panels line hallway qualley looks part persona none mischievous charm scheming intricacy needed resonate left worrying sensation someone somewhere fancies idea sequel take money box office it’s watchable enough another cinematic example something originally unbroken need fixing seventyfive years later,"Comedy, Thriller"
Send Help,"['Horror', 'Thriller', 'Comedy']","The spirit of “Nine to Five” (1980) is alive and well for “Linda” (Rachel McAdams) as she is constantly being passed over for promotion by golf-playing men who rely on her to do all the work. She hopes for change when new employer “Bradley” (Dylan O’Brien) takes over from his dad, but a combination of his best mate from university and her liking for tuna duly kiboshes that. She is, however, to embark on a team trip to Thailand for a merger meeting and it’s en route that a violent storm leaves her and her hapless boss stranded on a tropical island. It turns out that she is a woman well equipped to survive whilst the injured ""Brad"" hasn’t a clue, so yet again she appears to be doing all the donkey work whilst he lies under a palm frond expecting to be waited on hand and foot. Exasperated, “Linda” decides she can get by without this obnoxious parasite and so leaves him to languish in the sun in the hope that he will come to realise his failings and her value. Now with new lines slowly being drawn between them, what chance they will be rescued and are either of them being remotely honest with the other? Whilst this isn’t really scary at all, there is still quite a fun “Robinson Crusoe” dynamic between McAdams and O’Brien as their battle of the sexes ebbs and flows. They finesse the arts of boar hunting and berry eating; he learns to appreciate the eye-watering dangers of toxic fish and for most of the film it’s an enjoyably pithy and well-written joust between these two, clearly unevenly matched, characters. I didn’t really like the last twenty minutes so much. They felt rushed, unnecessarily violent and though there is a juicy degree of vindication about it, it didn’t quite top off what is an otherwise entertaining drama that mercifully keeps romance at bay throughout as it shouts clearly the benefits of a meritocracy.",7.0,1198994,698cced895efac1ec2425e0e,CinemaSerf,2026-02-11T18:47:52.236Z,spirit “nine five” 1980 alive well “linda” rachel mcadams constantly passed promotion golfplaying men rely work hopes change new employer “bradley” dylan o’brien takes dad combination best mate university liking tuna duly kiboshes however embark team trip thailand merger meeting it’s en route violent storm leaves hapless boss stranded tropical island turns woman well equipped survive whilst injured brad hasn’t clue yet appears donkey work whilst lies palm frond expecting waited hand foot exasperated “linda” decides get without obnoxious parasite leaves languish sun hope come realise failings value new lines slowly drawn chance rescued either remotely honest whilst isn’t really scary still quite fun “robinson crusoe” dynamic mcadams o’brien battle sexes ebbs flows finesse arts boar hunting berry eating learns appreciate eyewatering dangers toxic fish film it’s enjoyably pithy wellwritten joust two clearly unevenly matched characters didn’t really like last twenty minutes much felt rushed unnecessarily violent though juicy degree vindication didn’t quite top otherwise entertaining drama mercifully keeps romance bay throughout shouts clearly benefits meritocracy,"Horror, Thriller, Comedy"
Sinners,"['Horror', 'Action', 'Thriller']","This was alright, decent vamp flick, but I don't really get the super high praise for this movie. I liked the lighting in the final scene. Ham on face.",6.0,1233413,689e21d12f760b149d1a3da7,hamfaceman,2025-08-14T17:50:09.496Z,alright decent vamp flick dont really get super high praise movie liked lighting final scene ham face,"Horror, Action, Thriller"
Predator: Badlands,"['Action', 'Science Fiction', 'Adventure']","“Dek” is the runt of the “Yautja” clan so his militaristic father has asked his elder brother “Kwei” to get rid of him. Luckily, his brother isn’t so brutal and so with an impossible task on his hands to prove his worth, “Dek” manages to escape to a planet where he seeks to make a trophy from the menacing “Kalisk”. Thing is, this place is riddled with all sorts of flesh-eating monsters and plants so his own survival chances aren’t especially high until he encounters the top half of synthetic “Thia” (Elle Fanning) who is quite hot on keeping him alive and who agrees to work with him to achieve his task. It turns out, though, that she and her mission doppelgänger “Tessa” are on this world for a similar reason and him getting back home is not in their plans, let alone home with a creature that has impressive regenerative powers. What chance the young “Dek” can achieve his task, or perhaps even better - do something his tribe never do and learn to cooperate and maybe even make friends? Now it is fractionally better, but for the most part this really just reminded me of Adam Driver’s “65” (2023) as the whole premise of the “Predator” - the menacing and all-conquering alpha hunter - is abandoned in favour of this great looking but derivative story of survival with fangs against critters and plants that could have caused a stir in “Star Trek” in the 1960s. By flipping the established plot on it’s head like this, Dan Trachtenberg is almost asking us to sympathise for “Dek” rather than hide behind the sofa, and this manages to disappointingly humanise him - albeit monosyllabically - and reduce any sense of menace to a bare minimum. Sorry, but I was underwhelmed by the whole thing.",6.0,1242898,691f018f2b92d38310eb669a,CinemaSerf,2025-11-20T11:54:55.384Z,“dek” runt “yautja” clan militaristic father asked elder brother “kwei” get rid luckily brother isn’t brutal impossible task hands prove worth “dek” manages escape planet seeks make trophy menacing “kalisk” thing place riddled sorts flesheating monsters plants survival chances aren’t especially high encounters top half synthetic “thia” elle fanning quite hot keeping alive agrees work achieve task turns though mission doppelgänger “tessa” world similar reason getting back home plans let alone home creature impressive regenerative powers chance young “dek” achieve task perhaps even better something tribe never learn cooperate maybe even make friends fractionally better part really reminded adam driver’s “65” 2023 whole premise “predator” menacing allconquering alpha hunter abandoned favour great looking derivative story survival fangs critters plants could caused stir “star trek” 1960s flipping established plot it’s head like dan trachtenberg almost asking us sympathise “dek” rather hide behind sofa manages disappointingly humanise albeit monosyllabically reduce sense menace bare minimum sorry underwhelmed whole thing,"Action, Science Fiction, Adventure"
28 Years Later: The Bone Temple,"['Horror', 'Thriller', 'Science Fiction']","I'm not quite as taken with ""28 Years Later: The Bone Temple"" as I was with its immediate predecessor. 

The considered, intelligent, insightful aspects of this film, embodied in Ralph Fiennes's Dr Ian Kelson character, are undermined with the re-introduction of the stabby satanic fashion refugees from the closing scenes of the last film. I was critical of their rather ridiculous Clockwork Orange-at-the-end-of-the-world-style antics and remain so.  

Their oftentimes moronic presence drags this film down, reducing it to an often grotesque farce on more than one occasion. The ""we're all Jimmy"" line is reminiscent of ""we're Negan"" from The Walking Dead, minus the gritty gravitas.

In summary, not a bad film but not a great one either. Sophisticated elements, diluted to often mild stupidity by the almost cartoonish presence, of the oddball fashion extras, with a satanic infatuation. ",7.0,1272837,696f0b3fddfa392ea0caecf0,MovieGuys,2026-01-20T04:57:35.859Z,im quite taken 28 years later bone temple immediate predecessor considered intelligent insightful aspects film embodied ralph fienness dr ian kelson character undermined reintroduction stabby satanic fashion refugees closing scenes last film critical rather ridiculous clockwork orangeattheendoftheworldstyle antics remain oftentimes moronic presence drags film reducing often grotesque farce one occasion jimmy line reminiscent negan walking dead minus gritty gravitas summary bad film great one either sophisticated elements diluted often mild stupidity almost cartoonish presence oddball fashion extras satanic infatuation,"Horror, Thriller, Science Fiction"
The Super Mario Bros. Movie,"['Family', 'Comedy', 'Adventure', 'Fantasy', 'Animation']","It's a good!

My experience of <em>'Mario'</em> starts and ends with <em>'Mario Kart'</em>, which I haven't actually played since back in the day on my Nintendo DS and even then I had no understanding of the franchise itself; just treated it as a normal racing game. I was an Xbox kid growing up (thanks, ma!), so that be the reason. Anyway, that's a long way of saying I'm no Mario know-it-all.

Despite all that, I do remember most of the characters from the aforementioned video game and it was cool seeing them come to life in 'The Super Mario Bros. Movie'. Chris Pratt feels an odd cast for Mario but does do a solid job in fairness to him. Jack Black and Charlie Day are very good in their roles as Bowser and Luigi. Keegan-Michael Key, Seth Rogen and Anya Taylor-Joy are also positives as Toad, Donkey King and Princess Peach.

No doubt whatsoever that this will be the first film of a crap tonne from this franchise. Still, if they do as well as they did here then they'll be successful, I'm sure. I'd be up for exploring the world via film, tbf.",7.0,502356,65a33d767d5f4b00ceb7bd36,r96sk,2024-01-14T01:48:38.720Z,good experience emmarioem starts ends emmario kartem havent actually played since back day nintendo ds even understanding franchise treated normal racing game xbox kid growing thanks reason anyway thats long way saying im mario knowitall despite remember characters aforementioned video game cool seeing come life super mario bros movie chris pratt feels odd cast mario solid job fairness jack black charlie day good roles bowser luigi keeganmichael key seth rogen anya taylorjoy also positives toad donkey king princess peach doubt whatsoever first film crap tonne franchise still well theyll successful im sure id exploring world via film tbf,"Family, Comedy, Adventure, Fantasy, Animation"
Sinners,"['Horror', 'Action', 'Thriller']","Michael B. Jordan is “Smoke” and twin brother “Stack” in this classy drama of a pair who’ve lived on the wrong side of the tracks for most of their lives, but have determined to go home and try to go straight. To that end, they buy an old barn and hope to set up their own speakeasy - with only a nominal nod to prohibition - pumping to the rafters with dancing and blues music. On the way, they ally with talented musician “Sammie” (Miles Caton) and, of course, there’s a bit of baggage for the siblings as they return to a town that’s not altogether welcoming. Once home, a mixture of confidence, threats and collective charisma succeeds in assembling a crowd for their opening night. Pretty swiftly, though, that grand celebration attracts the attention of some travellers who are keen to join the party, but perhaps in true Charlie Daniels style, they have an altogether more menacing agenda. This is the cinematic equivalent of an LP, this film. It starts with one side gradually introducing us a rich collection of characters all of whom could quite plausibly have lived in Mississippi at a time when segregation was as rife as illicit booze, and the two more recently hailing from Chicago gives things a certain gangster element too. There is also a very subtly powerful effort from Hailee Steinfield as “Mary” too. The flip side of the record proceeds to develop some elements of peril with the story, and that’s where it rather runs out of steam for me. It tries very hard to create a sense of hot, sweaty and frenzied jeopardy, but maybe because it has already taken quite a long time to get to this stage, that all comes across as a bit rushed and lacking in punch. It looks great, the visual effects are convincing enough and the production design smoulders perfectly. In the end, though, whilst it proves that MBJ is comfortably able to hold a story, Ryan Coogler has overly relied on a marvellously toe-tapping musical score that has been left to do much of the heavy lifting. That latter point is made more essential by a mediocre audio mix that can make the dialogue quite difficult to make out more often than I’d have liked. This seems to be an increasing issue as directors become more ambitious with their visual aspirations leaving the one thing that cannot be readily faked/augmented - the sound - left at the altar. It’s a cinema film, and will look distinctly average on a television so big screen and soundtrack audio is essential to get the best from this silky looking story with an interesting twist at the end, and again at the very end.",7.0,1233413,681f15b1a74b6fc9ebc84997,CinemaSerf,2025-05-10T09:00:33.979Z,michael b jordan “smoke” twin brother “stack” classy drama pair who’ve lived wrong side tracks lives determined go home try go straight end buy old barn hope set speakeasy nominal nod prohibition pumping rafters dancing blues music way ally talented musician “sammie” miles caton course there’s bit baggage siblings return town that’s altogether welcoming home mixture confidence threats collective charisma succeeds assembling crowd opening night pretty swiftly though grand celebration attracts attention travellers keen join party perhaps true charlie daniels style altogether menacing agenda cinematic equivalent lp film starts one side gradually introducing us rich collection characters could quite plausibly lived mississippi time segregation rife illicit booze two recently hailing chicago gives things certain gangster element also subtly powerful effort hailee steinfield “mary” flip side record proceeds develop elements peril story that’s rather runs steam tries hard create sense hot sweaty frenzied jeopardy maybe already taken quite long time get stage comes across bit rushed lacking punch looks great visual effects convincing enough production design smoulders perfectly end though whilst proves mbj comfortably able hold story ryan coogler overly relied marvellously toetapping musical score left much heavy lifting latter point made essential mediocre audio mix make dialogue quite difficult make often i’d liked seems increasing issue directors become ambitious visual aspirations leaving one thing cannot readily fakedaugmented sound left altar it’s cinema film look distinctly average television big screen soundtrack audio essential get best silky looking story interesting twist end end,"Horror, Action, Thriller"
