movie_title,genres,content,rating,movie_id,review_id,author,created_at,cleaned_text,category
The Shawshank Redemption,"['Drama', 'Crime']","This is much more predictable and Hollywood than a King novel.
This story of another man wrongfully in prison for murder joins the list of about every other movie about a man sent to prison for murdering his wife.
And therein lies the problem. Most of the time, the killer is the husband, and most of the time the right man is in prison.
Juries are now doomed to consist of several people who are brainwashed by this constant propaganda Hollywood gives us and think accordingly.
People are not gods. They are souls and spirits that can only withstand so much brainwashing. 
Add to that, the story plods along with really nothing new to add. It's a very formula movie.
I won't say it is a ""bad movie"". Those are ones I give 1 or 2 out of 10. But 3/10 is what I call the very boring, unimaginative, safe, non thought provoking movies that you forget about quite quickly.",3.0,278,642af2ffc0a30800774eb399,drystyx,2023-04-03T15:38:39.540Z,much predictable hollywood king novel story another man wrongfully prison murder joins list every movie man sent prison murdering wife therein lies problem time killer husband time right man prison juries doomed consist several people brainwashed constant propaganda hollywood gives us think accordingly people gods souls spirits withstand much brainwashing add story plods along really nothing new add formula movie wont say bad movie ones give 1 2 10 310 call boring unimaginative safe non thought provoking movies forget quite quickly,"Drama, Crime"
War Machine,"['Action', 'Science Fiction', 'Thriller']","A simple action film starring muscleman Alan Ritchson, known from the DC series Titans and Reacher. A visibly aged Dennis Quaid also makes a cameo appearance. All in all, it's a straightforward and bloody film. The characters remain nameless, identified only by numbers. The film is entertaining but lacks depth, requiring careful attention.",5.0,1265609,69b51f93181da5e9383b8a2e,Durdahn,2026-03-14T08:42:59.638Z,simple action film starring muscleman alan ritchson known dc series titans reacher visibly aged dennis quaid also makes cameo appearance straightforward bloody film characters remain nameless identified numbers film entertaining lacks depth requiring careful attention,"Action, Science Fiction, Thriller"
Star Wars: The Last Jedi,"['Adventure', 'Action', 'Science Fiction']","Some of the praise, at least from the fans is because of the deviation from Star Wars tradition which, honestly, I have an issue with out the door. We are watching it because we want to see a Star Wars film.

And the deviation from Star Wars tradition seems especially ridiculous given how hard it tries--like The Force Awakens--to rely on nostalgia to keep the fans that felt alienated when Rey turned out to be, well, absolutely flawless, absolutely loved and trusted by absolutely everyone, and faced no real challenges or struggles...

...so, bank on nostalgia because giving the primary character a real literary struggle to add to a sense of character and plot is still seemingly out of the question.

And that kind of seems like a troupe now days of characters that are diverse for the state of diversity. It seems like their creator and political fans feel that adding any struggle for said character to overcome would somehow take away from the political importance of the character.

And that holds true for The Last Jedi. Rey still has no real struggles that can create even the slightest bit of dramatic tension for the audience. It is understood that she is the best and can easily overcome anything the story throws at her...and she does.

And that is the reason her character is rejected by fans. It doesn't make for good cinema. Skywalker had the same issues in I-III, but at least it was understood that he was going to fail at the end of his story arc only to be redeemed in Luke's.

Rey is still so perfect there is no dramatic tension where she is involved.

But, don't let that be the only thing that kills it for you. Poe's initial radio play with the new faux Empire sets the entire movie up for one long eye roll. Those jokes seemed so out of place for science-fiction that it killed the movie from the start.

But then the bad humor of your lame aunt that only think's she's funny is also a new troupe for movies for movies like this.

So the films have to rely on nostalgia to market it to fans of the last two trilogies...and in this case it doesn't really work. The nostalgia is more along the lines of ""Remember when Luke Skywalker was a thing"" variety. The sort of nostalgia that references the old beloved franchise, without really understanding the dynamic of it.

They did the same ""Remember when this happened"" nostalgic ploy in The Force Awakens and, like then they didn't have the background and understanding to pull it off. Solo wasn't really the cynical untrusting scoundrel that made him so beloved. And in this one Luke isn't the whiny flawed but blindly moral hero that gets in over his head.

The result is a nostalgia that is just an empty reference. A nostalgia that has no real idea what it is referencing, or at least not one that runs any deeper than the surface.

So the jokes don't land. So hero doesn't struggle and... ...the film has no real drama because of the lack of struggle. So the nostalgia is only skin deep and... ...it results in a nostalgia that is more of an insult to the older fan base that it tries to appeal to.

Disney didn't listen to the fans that complained about The Force Awakens. They were too busy calling them names for not loving the film. All the fans wanted was a story, that is all, they wanted a struggle, they wanted real drama. They wanted the characters they loved to be the characters they loved.

What they got instead was a character easily walks into every situation and beats every adversity with ease still...despite that being the main complaint.

What they got was old heroes acting like different people again.

What they got was another bad movie.",1.0,181808,63c20b9117b5ef00a7fbad33,GenerationofSwine,2023-01-14T01:55:29.174Z,praise least fans deviation star wars tradition honestly issue door watching want see star wars film deviation star wars tradition seems especially ridiculous given hard trieslike force awakensto rely nostalgia keep fans felt alienated rey turned well absolutely flawless absolutely loved trusted absolutely everyone faced real challenges struggles bank nostalgia giving primary character real literary struggle add sense character plot still seemingly question kind seems like troupe days characters diverse state diversity seems like creator political fans feel adding struggle said character overcome would somehow take away political importance character holds true last jedi rey still real struggles create even slightest bit dramatic tension audience understood best easily overcome anything story throws herand reason character rejected fans doesnt make good cinema skywalker issues iiii least understood going fail end story arc redeemed lukes rey still perfect dramatic tension involved dont let thing kills poes initial radio play new faux empire sets entire movie one long eye roll jokes seemed place sciencefiction killed movie start bad humor lame aunt thinks shes funny also new troupe movies movies like films rely nostalgia market fans last two trilogiesand case doesnt really work nostalgia along lines remember luke skywalker thing variety sort nostalgia references old beloved franchise without really understanding dynamic remember happened nostalgic ploy force awakens like didnt background understanding pull solo wasnt really cynical untrusting scoundrel made beloved one luke isnt whiny flawed blindly moral hero gets head result nostalgia empty reference nostalgia real idea referencing least one runs deeper surface jokes dont land hero doesnt struggle film real drama lack struggle nostalgia skin deep results nostalgia insult older fan base tries appeal disney didnt listen fans complained force awakens busy calling names loving film fans wanted story wanted struggle wanted real drama wanted characters loved characters loved got instead character easily walks every situation beats every adversity ease stilldespite main complaint got old heroes acting like different people got another bad movie,"Adventure, Action, Science Fiction"
Now You See Me: Now You Don't,"['Crime', 'Thriller']","**Boring and stupid**

Hard to believe that after so many years of hiatus, the franchise will bring such a stupidly boring movie.

The original movie was all about deception, magic, and surprises. This movie, however, tries to be a love child of Indiana Jones and Mission Impossible. It was less about magic and more about running and chasing.

Too many plot holes. A billionaire and her security act like completely stupid people. The magicians had no plans beyond stealing the diamond and then just running (really?). The new characters are uninteresting, somewhat annoying, and easily forgettable. There were some woke messages as well to make the movie stink worse.

Just watch the first scene of the first movie of this franchise, and you will realize how clever the original was and how stupid the present one is.

I lost all hope from the present-day creators.",2.0,425274,6958e78dbf4a3fbe834af0ff,dumasori,2026-01-03T09:55:25.272Z,boring stupid hard believe many years hiatus franchise bring stupidly boring movie original movie deception magic surprises movie however tries love child indiana jones mission impossible less magic running chasing many plot holes billionaire security act like completely stupid people magicians plans beyond stealing diamond running really new characters uninteresting somewhat annoying easily forgettable woke messages well make movie stink worse watch first scene first movie franchise realize clever original stupid present one lost hope presentday creators,"Crime, Thriller"
Return to Silent Hill,"['Mystery', 'Drama', 'Horror']","When it takes over thirty minutes for a film to go anywhere even remotely interesting, for my money, something is wrong.

""Return to Silent Hill"" lacks both pace and scares; in short, I found it boring. It's not the actors' fault; they hand in decent performances. Its story, in my opinion, needed to be reworked to make it more engaging and exciting.

In summary, acting is fine, but I found the story lackadaisical and dull. Can't recommend this one.",4.0,680493,6976f685e1d733d98c1a136c,MovieGuys,2026-01-26T05:07:17.558Z,takes thirty minutes film go anywhere even remotely interesting money something wrong return silent hill lacks pace scares short found boring actors fault hand decent performances story opinion needed reworked make engaging exciting summary acting fine found story lackadaisical dull cant recommend one,"Mystery, Drama, Horror"
Titanic,"['Drama', 'Romance']","It could be because it came out when I was 17 and I had to go see it twice in the theater on two dates, and then I had to take my mom to see it.

Or it could be because Kate here is sort of a horrible person, really self centered, does a lot of pretty bad things, and we are supposed to root for her.

Or it could be because when it came out I got tired of the hype.

Or it could be because there was room enough for Leo but he had to die to make it ""romantic.""

But whatever the reason, I'm really not a fan of this film.",1.0,597,6931156a475641b3e8c1e7cb,GenerationofSwine,2025-12-04T05:00:27.011Z,could came 17 go see twice theater two dates take mom see could kate sort horrible person really self centered lot pretty bad things supposed root could came got tired hype could room enough leo die make romantic whatever reason im really fan film,"Drama, Romance"
Titanic,"['Drama', 'Romance']","It could be because it came out when I was 17 and I had to go see it twice in the theater on two dates, and then I had to take my mom to see it.

Or it could be because Kate here is sort of a horrible person, really self centered, does a lot of pretty bad things, and we are supposed to root for her.

Or it could be because when it came out I got tired of the hype.

Or it could be because there was room enough for Leo but he had to die to make it ""romantic.""

But whatever the reason, I'm really not a fan of this film.",1.0,597,6931156a475641b3e8c1e7cb,GenerationofSwine,2025-12-04T05:00:27.011Z,could came 17 go see twice theater two dates take mom see could kate sort horrible person really self centered lot pretty bad things supposed root could came got tired hype could room enough leo die make romantic whatever reason im really fan film,"Drama, Romance"
War of the Worlds,"['Science Fiction', 'Thriller']",Trash. Uber trash. Worst use of an IP to date.,2.0,755898,6896e7c097e8b74ed492e923,Microcosmic,2025-08-09T06:16:32.146Z,trash uber trash worst use ip date,"Science Fiction, Thriller"
Avatar: Fire and Ash,"['Science Fiction', 'Adventure', 'Fantasy']","FULL SPOILER-FREE REVIEW @ https://movieswetextedabout.com/avatar-fire-and-ash-movie-review-james-cameron-finds-himself-between-technical-brilliance-and-creative-stagnation/

""Avatar: Fire and Ash leaves me with mixed feelings of technical admiration and creative exhaustion. It's a film that lives off its scale, scope, and technical audacity but fails to take the step forward the narrative required to become memorable on its own merit.

Cinema cannot just be a technology demonstration; it needs characters whose journeys we feel as our own, themes that are explored in depth, and stories that aren't limited to repeating past successes. There are fascinating ideas here, from Neytiri's grief to Kiri's divine isolation and Varang's antagonistic beliefs, but they're lost under a cynical structure and unjustified plot decisions that make the experience truly frustrating. The lack of clarity about the fate of certain characters and the stagnation of some arcs make me fear that the next movies will follow the same path.

James Cameron is an undeniable visionary, but he seems to have forgotten that for a flame to keep burning brightly, it needs new fuel and not just the ashes of yesterday.""

Rating: C",5.0,83533,6943d8d0a56edf751f705664,Manuel São Bento,2025-12-18T10:34:56.770Z,full spoilerfree review avatar fire ash leaves mixed feelings technical admiration creative exhaustion film lives scale scope technical audacity fails take step forward narrative required become memorable merit cinema cannot technology demonstration needs characters whose journeys feel themes explored depth stories arent limited repeating past successes fascinating ideas neytiris grief kiris divine isolation varangs antagonistic beliefs theyre lost cynical structure unjustified plot decisions make experience truly frustrating lack clarity fate certain characters stagnation arcs make fear next movies follow path james cameron undeniable visionary seems forgotten flame keep burning brightly needs new fuel ashes yesterday rating c,"Science Fiction, Adventure, Fantasy"
Return to Silent Hill,"['Mystery', 'Drama', 'Horror']","Ok, so I don’t remember going to “Silent Hill” first time around (in 2006), but after this I am certain I will never go again. At least Christopher Gans had enough wits about him to cast someone easy on the eye in the lead, but even the ashen-looking Jeremy Irvine couldn’t breathe any life into this. He’s “James” who meets up with “Mary” (Hannah Emily Anderson) after he managed to hit her luggage with his car. Thereafter they flirt, court, move in together, split up - but as far as this plot is concerned, in no coherent order and only delivered to us by way of flashback. It’s only as he returns to find her again he discovers the town is now the victim of what looks like a nearby meteor strike and the place devoid of all but some curious humanoid creatures that definitely mean him harm. Can he put the pieces of this emotionally confused jigsaw together? Do we care? If this were just to have been a monster film with Irvine in a semi-psychotic fight for survival, then perhaps it might have worked better. It isn’t. The timelines are all over the place; characters appear and the disappear seemingly quite randomly and the psychological impact of the story is so compromised as to render this little better than a mess that looks every inch an incremental video game put onto a big screen. Some of the creativity behind the visual effects is to be commended but the story is completely lacking in either characterisation or substance. It will kill some time on the telly in October, maybe, but otherwise this has little to recommend it to anyone.",5.0,680493,697b95dea8c024bc53a08e55,CinemaSerf,2026-01-29T17:16:14.261Z,ok don’t remember going “silent hill” first time around 2006 certain never go least christopher gans enough wits cast someone easy eye lead even ashenlooking jeremy irvine couldn’t breathe life he’s “james” meets “mary” hannah emily anderson managed hit luggage car thereafter flirt court move together split far plot concerned coherent order delivered us way flashback it’s returns find discovers town victim looks like nearby meteor strike place devoid curious humanoid creatures definitely mean harm put pieces emotionally confused jigsaw together care monster film irvine semipsychotic fight survival perhaps might worked better isn’t timelines place characters appear disappear seemingly quite randomly psychological impact story compromised render little better mess looks every inch incremental video game put onto big screen creativity behind visual effects commended story completely lacking either characterisation substance kill time telly october maybe otherwise little recommend anyone,"Mystery, Drama, Horror"
Jurassic World Rebirth,"['Science Fiction', 'Adventure', 'Action']","_Jurassic World Rebirth_ tries to revive the magic but mostly goes through the motions. The dinosaurs look fine, but the sense of wonder’s long gone. The plot recycles old beats—corporate greed, a betrayal, someone shouting “Run!”—while new characters feel like action figures with catchphrases. A few set pieces land, and it’s refreshing to see a Hispanic family in the lead, even if they feel a bit gimmicky. It’s not bad, just safe. If you want thrills, it delivers. Just don’t expect awe.",5.0,1234821,685b9a2acf4bdffedfee6701,griggs79,2025-06-25T06:41:46.796Z,jurassic world rebirth tries revive magic mostly goes motions dinosaurs look fine sense wonder’s long gone plot recycles old beats—corporate greed betrayal someone shouting “run”—while new characters feel like action figures catchphrases set pieces land it’s refreshing see hispanic family lead even feel bit gimmicky it’s bad safe want thrills delivers don’t expect awe,"Science Fiction, Adventure, Action"
The Super Mario Galaxy Movie,"['Family', 'Comedy', 'Adventure', 'Fantasy', 'Animation']","Now I know that I'm not really the demographic for this, but I didn't mind the last one from 2023 so had an open mind as it started. Princess 'Peach' is kidnapped by the menacing baby 'Bowser' who is none too pleased that his dad has been locked up. He is determined to use her as leverage to free him, but that is exactly what intrepid and ingenious 'Mario' and 'Luigi' intend to thwart. What now ensues is the thinnest of stories stretched across a messy collection of interstellar scenarios as they bounce from world to world trying to rescue the royal damsel in distress. I always reckoned that the amiable mushroom people belonged more in an Arabian Nights tale than a sci-fi cartoon, but even their innocent cheeriness can't really enliven this rapidly and colourfully edited together sequence of pinball-machine style scenes. There is surprisingly little effort made to characterise either the goodies or the baddies and the frenetic nature of the animation barely leaves us time to draw breath before we ascend to another level and pretty much repeat as before - only with slightly different props and goals. It's not so much that this lacks a beginning, middle and end - it is more that it just comes across as contant sequence of scenes that could all see the film conclude as predictably as the sun coming up. Perhaps very young children might enjoy the sheer buzz of this, but there really isn't anything visually or from the script to entertain the grown ups. I bet the merch merchants are happy, though.",5.0,1226863,69df4cf1f6dafa2d54211a2b,CinemaSerf,2026-04-15T08:31:45.605Z,know im really demographic didnt mind last one 2023 open mind started princess peach kidnapped menacing baby bowser none pleased dad locked determined use leverage free exactly intrepid ingenious mario luigi intend thwart ensues thinnest stories stretched across messy collection interstellar scenarios bounce world world trying rescue royal damsel distress always reckoned amiable mushroom people belonged arabian nights tale scifi cartoon even innocent cheeriness cant really enliven rapidly colourfully edited together sequence pinballmachine style scenes surprisingly little effort made characterise either goodies baddies frenetic nature animation barely leaves us time draw breath ascend another level pretty much repeat slightly different props goals much lacks beginning middle end comes across contant sequence scenes could see film conclude predictably sun coming perhaps young children might enjoy sheer buzz really isnt anything visually script entertain grown ups bet merch merchants happy though,"Family, Comedy, Adventure, Fantasy, Animation"
